{
  "id": "T1078",
  "name": "Valid Accounts",
  "type": "mitre_technique",
  "tactics": [
    "TA0001",
    "TA0003",
    "TA0004",
    "TA0005"
  ],
  "platforms": [
    "Windows",
    "Linux",
    "macOS",
    "Azure AD",
    "Office 365",
    "SaaS",
    "IaaS",
    "Google Workspace",
    "Containers"
  ],
  "brief": {
    "en": "Adversaries may obtain and abuse credentials of existing accounts as a means of gaining initial access, maintaining persistence, escalating privileges, or evading defenses.",
    "pt": "Adversários podem obter e abusar de credenciais de contas existentes como forma de obter acesso inicial, manter persistência, escalar privilégios ou evitar detecção.",
    "de": "Angreifer können Anmeldedaten bestehender Konten erlangen und missbrauchen, um sich Erstzugriff zu verschaffen, Persistenz aufrechtzuerhalten, Rechte zu erweitern oder Abwehrmaßnahmen zu umgehen."
  },
  "investigation_context": {
    "what_it_means": {
      "en": "Indicates that a legitimate account (not one created by the attacker) was used to perform the observed activity — the key difference from other techniques is that the credential is valid, which makes detection harder.",
      "pt": "Indica que uma conta legítima (não uma conta criada pelo atacante) foi usada para realizar a atividade observada — a diferença chave em relação a outras técnicas é que a credencial é válida, tornando a detecção mais difícil.",
      "de": "Zeigt an, dass ein legitimes Konto (nicht ein vom Angreifer erstelltes) für die beobachtete Aktivität verwendet wurde — der entscheidende Unterschied zu anderen Techniken ist, dass die Anmeldedaten gültig sind, was die Erkennung erschwert."
    },
    "why_it_matters": {
      "en": "Using valid accounts blends in with normal environment behavior. It is often the root cause behind other observed techniques, such as account manipulation (T1098): you need to determine where the access to the manipulating account came from.",
      "pt": "O uso de contas válidas se mistura com o comportamento normal do ambiente. É frequentemente a explicação raiz por trás de outras técnicas observadas, como manipulação de conta (T1098): é preciso determinar de onde veio o acesso à conta usada para a manipulação.",
      "de": "Die Verwendung gültiger Konten fügt sich in normales Umgebungsverhalten ein. Sie ist oft die Grundursache hinter anderen beobachteten Techniken, wie z. B. Kontomanipulation (T1098): Es muss ermittelt werden, woher der Zugriff auf das manipulierende Konto stammt."
    },
    "suspicious_when": {
      "en": [
        "Account used at an unusual time or location for that user",
        "Account performing actions outside its normal usage pattern (e.g. a service account doing an interactive login)",
        "Account associated with prior credential compromise alerts",
        "Account use immediately followed by persistence or privilege escalation actions"
      ],
      "pt": [
        "Conta usada em horário ou localização incomum para o usuário",
        "Conta usada para realizar ações fora do seu padrão normal de uso (ex: uma conta de serviço realizando login interativo)",
        "Conta associada a alertas prévios de comprometimento de credenciais",
        "Uso da conta seguido imediatamente por ações de persistência ou escalonamento de privilégio"
      ],
      "de": [
        "Konto zu ungewöhnlicher Zeit oder an ungewöhnlichem Ort für diesen Benutzer verwendet",
        "Konto führt Aktionen außerhalb seines normalen Nutzungsmusters aus (z. B. interaktive Anmeldung eines Dienstkontos)",
        "Konto mit vorherigen Warnungen zu kompromittierten Anmeldedaten verknüpft",
        "Kontonutzung unmittelbar gefolgt von Persistenz- oder Rechteerweiterungsaktionen"
      ]
    },
    "legitimate_when": {
      "en": [
        "IT administrator connection for documented maintenance",
        "Usage consistent with that user's historical pattern"
      ],
      "pt": [
        "Uso da conta é consistente com o padrão histórico do usuário",
        "Atividade coincide com uma mudança aprovada ou tarefa administrativa esperada"
      ],
      "de": [
        "Verbindung eines IT-Administrators für dokumentierte Wartung",
        "Nutzung entspricht dem historischen Muster dieses Benutzers"
      ]
    },
    "common_mistakes": {
      "en": [
        "Assuming that because the credential is valid, the activity is automatically legitimate",
        "Not correlating account use with subsequent manipulation or escalation events"
      ],
      "pt": [
        "Assumir que, por a credencial ser válida, a atividade é automaticamente legítima",
        "Não correlacionar o uso da conta com eventos subsequentes de manipulação ou escalonamento"
      ],
      "de": [
        "Anzunehmen, dass die Aktivität automatisch legitim ist, nur weil die Anmeldedaten gültig sind",
        "Die Kontonutzung nicht mit nachfolgenden Manipulations- oder Eskalationsereignissen zu korrelieren"
      ]
    }
  },
  "expected_evidence": [
    "authentication_event",
    "user",
    "host",
    "ip_address"
  ],
  "related_hypotheses": [],
  "suggested_checks": [],
  "detection_analytics": [],
  "references": [
    {
      "title": "MITRE ATT&CK - T1078 Valid Accounts",
      "url": "https://attack.mitre.org/techniques/T1078/"
    }
  ]
}
